[
  {
    "$schema": "readerx/book-source-rule/v1",
    "id": "https://www.qidian.com",
    "name": "起点中文",
    "description": "搜索需要先通过浏览器访问起点写入 Cookie",
    "type": "novel",
    "tags": ["正版"],
    "baseUrl": "https://www.qidian.com",
    "headers": {
      "User-Agent": "Mozilla/5.0 (Linux; Android 13) AppleWebKit/537.36 Chrome/120.0 Mobile Safari/537.36"
    },
    "loginUrl": "https://www.qidian.com/all/",
    "enabled": true,
    "weight": 99,
    "order": 0,
    "updatedAt": "2024-12-17T14:30:54+08:00",
    "search": {
      "url": "/so/{{key}}.html",
      "headers": {
        "User-Agent": "Mozilla/5.0 (Windows NT 10.0; Win64; x64) AppleWebKit/537.36 Chrome/102.0.0.0 Safari/537.36",
        "Referer": "https://www.qidian.com/"
      },
      "checkKeyWord": "斗破苍穹",
      "rules": {
        "list": { "css": ".res-book-item" },
        "name": { "css": ".book-info-title a", "attr": "text" },
        "url": {
          "css": "a[data-bid]",
          "attr": "data-bid",
          "transform": [{ "template": "https://m.qidian.com/book/{{result}}/" }]
        },
        "author": { "css": ".author .name", "attr": "text" },
        "cover": { "css": ".book-img-box img", "attr": "src" },
        "intro": { "css": ".intro", "attr": "text" },
        "kind": { "css": ".author a", "attr": "text" },
        "lastChapter": {
          "css": ".update a",
          "attr": "text",
          "transform": [{ "replace": { "pattern": "最新更新 ", "with": "" } }]
        },
        "wordCount": { "xpath": "//p[text()='总字数']/span/text()" }
      }
    },
    "explore": {
      "categories": [
        { "title": "男生榜单" },
        { "title": "月票榜", "url": "/rank/yuepiao/page{{page}}/" },
        { "title": "畅销榜", "url": "/rank/hotsales/page{{page}}/" },
        { "title": "推荐榜", "url": "/rank/recom/page{{page}}/" },
        { "title": "限时免费", "url": "/free/page{{page}}/" },
        { "title": "男生频道" },
        { "title": "最近更新", "url": "/all?update=1&siteid=1&page={{page}}" },
        { "title": "完本", "url": "/all?action=1&siteid=1&page={{page}}" },
        { "title": "玄幻", "url": "/all?chanId=21&siteid=1&page={{page}}" },
        { "title": "奇幻", "url": "/all?chanId=1&siteid=1&page={{page}}" },
        { "title": "武侠", "url": "/all?chanId=2&siteid=1&page={{page}}" },
        { "title": "仙侠", "url": "/all?chanId=22&siteid=1&page={{page}}" },
        { "title": "都市", "url": "/all?chanId=4&siteid=1&page={{page}}" },
        { "title": "历史", "url": "/all?chanId=5&siteid=1&page={{page}}" },
        { "title": "科幻", "url": "/all?chanId=9&siteid=1&page={{page}}" },
        { "title": "女生榜单" },
        { "title": "月票榜", "url": "/rank/mm/yuepiao/page{{page}}/" },
        {
          "title": "古代言情",
          "url": "/mm/all?chanId=80&siteid=0&page={{page}}"
        },
        {
          "title": "现代言情",
          "url": "/mm/all?chanId=82&siteid=0&page={{page}}"
        }
      ],
      "rules": {
        "list": { "css": "#book-img-text li" },
        "name": { "css": "h2 a", "attr": "text" },
        "url": {
          "css": "a[data-bid]",
          "attr": "data-bid",
          "transform": [{ "template": "https://m.qidian.com/book/{{result}}/" }]
        },
        "author": { "css": ".author .name", "attr": "text" },
        "cover": { "css": ".book-img-box img", "attr": "src" },
        "intro": { "css": ".intro", "attr": "text" },
        "lastChapter": {
          "css": ".update a",
          "attr": "text",
          "transform": [{ "replace": { "pattern": "最新更新 ", "with": "" } }]
        }
      }
    },
    "bookInfo": {
      "rules": {
        "name": { "xpath": "//meta[@property='og:novel:book_name']/@content" },
        "author": { "xpath": "//meta[@property='og:novel:author']/@content" },
        "cover": { "xpath": "//meta[@property='og:image']/@content" },
        "intro": { "xpath": "//meta[@property='og:description']/@content" },
        "kind": {
          "xpath": "//meta[@property='og:novel:category' or @property='og:novel:status' or @property='og:novel:update_time']/@content"
        },
        "lastChapter": {
          "xpath": "//meta[@property='og:novel:latest_chapter_name']/@content"
        },
        "tocUrl": { "css": "#details-menu a", "attr": "href" },
        "wordCount": {
          "css": ".book-meta",
          "attr": "text",
          "transform": [{ "replace": { "pattern": "\\|.*$", "with": "" } }]
        }
      }
    },
    "toc": {
      "responseType": "html",
      "rules": {
        "list": {
          "regex": ":\"sS\":(\\d),.*?\"cN\":\"(.*?)\",\"id\":(\\d+),.*?\"uT\":\"(.*?)\""
        },
        "name": { "regex": "\"cN\":\"(.*?)\"" },
        "url": {
          "regex": "\"id\":(\\d+)",
          "transform": [
            {
              "template": "https://vipreader.qidian.com/chapter/{{bookId}}/{{result}}/"
            }
          ]
        },
        "isVip": { "regex": ":\"sS\":(\\d)" },
        "updateTime": {
          "regex": "\"uT\":\"(.*?)\"",
          "transform": [{ "replace": { "pattern": "\".*", "with": "" } }]
        }
      }
    },
    "content": {
      "rules": {
        "text": { "css": ".read-content", "attr": "html" }
      }
    }
  },
  {
    "$schema": "readerx/book-source-rule/v1",
    "id": "http://appi.kuwo.cn",
    "name": "酷我小说",
    "type": "novel",
    "tags": ["API"],
    "baseUrl": "http://appi.kuwo.cn",
    "headers": {
      "Accept": "*/*",
      "Connection": "Close",
      "User-Agent": "Dalvik/2.1.0 (Linux; U; Android 8.0.0)"
    },
    "enabled": true,
    "weight": 50,
    "order": 4,
    "updatedAt": "2024-04-23T10:32:03+08:00",
    "search": {
      "url": "/novels/api/book/search?keyword={{key}}&pi={{page}}&ps=30",
      "responseType": "json",
      "rules": {
        "list": { "jsonpath": "$.data" },
        "name": { "jsonpath": "$.title" },
        "url": { "template": "/novels/api/book/{{$.book_id}}" },
        "author": { "jsonpath": "$.author_name" },
        "cover": { "jsonpath": "$.cover_url" },
        "intro": { "jsonpath": "$.intro" },
        "kind": {
          "template": "{{$.category_name}},{{$.status}}",
          "transform": [
            { "replace": { "pattern": "30", "with": "连载" } },
            { "replace": { "pattern": "50", "with": "完结" } }
          ]
        },
        "wordCount": { "jsonpath": "$.all_words" }
      }
    },
    "bookInfo": {
      "responseType": "json",
      "init": { "jsonpath": "$.data" },
      "rules": {
        "name": { "jsonpath": "$.title" },
        "author": { "jsonpath": "$.author_name" },
        "cover": { "jsonpath": "$.cover_url" },
        "intro": { "jsonpath": "$.intro" },
        "kind": {
          "template": "{{$.category_name}},{{$.status}}",
          "transform": [
            { "replace": { "pattern": "30", "with": "连载" } },
            { "replace": { "pattern": "50", "with": "完结" } },
            { "replace": { "pattern": "\\s..:.*", "with": "" } }
          ]
        },
        "lastChapter": {
          "jsonpath": "$.new_chapter_name",
          "transform": [
            {
              "replace": {
                "pattern": "正文卷\\.|正文\\.|VIP卷\\.|默认卷\\.|卷_|VIP章节\\.|免费章节\\.|章节目录\\.",
                "with": ""
              }
            }
          ]
        },
        "tocUrl": {
          "template": "/novels/api/book/{{$.book_id}}/chapters?paging=0"
        },
        "wordCount": { "jsonpath": "$.all_words" }
      }
    },
    "toc": {
      "responseType": "json",
      "rules": {
        "list": { "jsonpath": "$.data" },
        "name": {
          "jsonpath": "$.chapter_title",
          "transform": [
            {
              "replace": {
                "pattern": "正文卷\\.|正文\\.|VIP卷\\.|默认卷\\.|卷_|VIP章节\\.|免费章节\\.|章节目录\\.",
                "with": ""
              }
            }
          ]
        },
        "url": {
          "template": "/novels/api/book/{{$.book_id}}/chapters/{{$.chapter_id}}"
        },
        "updateTime": { "template": "{{$.volume_name}}•{{$.original_words}}字" }
      }
    },
    "content": {
      "responseType": "json",
      "rules": {
        "text": { "jsonpath": "$.data.content" }
      }
    }
  },
  {
    "$schema": "readerx/book-source-rule/v1",
    "id": "https://69shuba.cx",
    "name": "69书吧",
    "description": "需要挂代理使用。搜索暂不可用，可先通过发现或直接添加书籍详情页地址。",
    "type": "novel",
    "tags": ["需要代理", "人机验证-搜索", "搜索暂不可用"],
    "baseUrl": "https://69shuba.cx",
    "enabled": false,
    "weight": 25,
    "order": 7,
    "updatedAt": "2025-04-27T16:47:28+08:00",
    "search": {
      "url": "/modules/article/search.php",
      "method": "POST",
      "body": "searchkey={{key}}&searchtype=all",
      "charset": "gbk",
      "checkKeyWord": "我有一个",
      "rules": {
        "list": { "css": ".newbox ul li" },
        "name": { "css": "h3 a:last-child", "attr": "text" },
        "url": { "css": "h3 a:last-child", "attr": "href" },
        "author": { "css": ".label:nth-child(1)", "attr": "text" },
        "cover": { "css": "img", "attr": "src" },
        "intro": { "css": ".ellipsis_2", "attr": "text" },
        "kind": {
          "css": [".label:nth-child(2)", ".label:nth-child(3)"],
          "separator": ","
        },
        "lastChapter": { "css": ".zxzj p", "attr": "text" }
      }
    },
    "explore": {
      "categories": [
        { "title": "全部分类", "url": "/blist/class/0/{{page}}.htm" },
        { "title": "玄幻魔法", "url": "/blist/class/1/{{page}}.htm" },
        { "title": "修真武侠", "url": "/blist/class/2/{{page}}.htm" },
        { "title": "言情小说", "url": "/blist/class/3/{{page}}.htm" },
        { "title": "历史军事", "url": "/blist/class/4/{{page}}.htm" },
        { "title": "科幻空间", "url": "/blist/class/6/{{page}}.htm" },
        { "title": "完本-全部分类", "url": "/blist/full/0/{{page}}.htm" },
        { "title": "完本-玄幻魔法", "url": "/blist/full/1/{{page}}.htm" },
        { "title": "完本-修真武侠", "url": "/blist/full/2/{{page}}.htm" }
      ],
      "rules": {
        "list": { "css": ".newlistbox ul li" },